{
  "checks": [
    {
      "name": "harness_redaction_tests",
      "seconds": 0.138,
      "status": "passed"
    },
    {
      "name": "proto",
      "seconds": 0.682,
      "status": "passed"
    },
    {
      "name": "disposable_init",
      "seconds": 1.343,
      "status": "passed"
    },
    {
      "name": "disposable_start",
      "seconds": 0.15,
      "status": "passed"
    },
    {
      "name": "disposable_database",
      "seconds": 0.174,
      "status": "passed"
    },
    {
      "name": "bootstrap",
      "seconds": 0.71,
      "status": "passed"
    },
    {
      "name": "migrations",
      "seconds": 2.566,
      "status": "passed"
    },
    {
      "name": "preflight",
      "seconds": 0.533,
      "status": "passed"
    },
    {
      "name": "contract_race",
      "required_skips": [],
      "seconds": 7.626,
      "status": "passed",
      "tests_passed": [
        "FuzzPreferenceClosedRequestJSON",
        "FuzzPreferenceClosedWire",
        "FuzzPreferenceCollectionBounds",
        "FuzzPreferenceExactNumbers",
        "FuzzPreferenceLiteralText",
        "FuzzPreferenceScopeUnion",
        "TestAdminContractLeavesAccountCredentialsToKeycloak",
        "TestAgentCanReadAndUpdateOwnUserProfile",
        "TestAllNineRequestShapes",
        "TestAllNineRequestShapes/DeleteMyPreferenceRequest",
        "TestAllNineRequestShapes/GetMyPreferenceContextRequest",
        "TestAllNineRequestShapes/GetMyPreferenceOperationStatusRequest",
        "TestAllNineRequestShapes/GetMyPreferenceRequest",
        "TestAllNineRequestShapes/ListMyPreferencesRequest",
        "TestAllNineRequestShapes/PreviewMyPreferenceDeletionRequest",
        "TestAllNineRequestShapes/PreviewMyPreferenceUpsertRequest",
        "TestAllNineRequestShapes/SearchPreferenceDefinitionsRequest",
        "TestAllNineRequestShapes/UpsertMyPreferenceRequest",
        "TestAuditIsPerRequest",
        "TestCanonicalAudienceIsStable",
        "TestCheckoutAndMutationContractsPinConcurrencyAndFingerprints",
        "TestCommerceMoneyAndRetiredFloatingPointFields",
        "TestCompactCustomKeyMatchesItsCategory",
        "TestContextMatchAndCustomGuidance",
        "TestCorrelationRejectsMalformedAndDuplicateMetadata",
        "TestCorrelationRejectsMalformedAndDuplicateMetadata/duplicate",
        "TestCorrelationRejectsMalformedAndDuplicateMetadata/newline",
        "TestCorrelationRejectsMalformedAndDuplicateMetadata/oversized",
        "TestCorrelationRejectsMalformedAndDuplicateMetadata/valid",
        "TestCorrelationRejectsMalformedAndDuplicateMetadata/zero_trace",
        "TestCustomerProtoRoundTrip",
        "TestCustomerServiceProtoRoundTrip",
        "TestDefinitionEnumsAndMetadataBounds",
        "TestEveryKnownMethodHasExactlyOneAccessClassification",
        "TestGatewayPolicyProjectionMatchesCanonicalRPCPolicies",
        "TestKnownGRPCMethodsExactlyMatchServiceDescriptors",
        "TestLegacyCartMethodsAreAbsentFromSecurityInventory",
        "TestMyOrderProjectionDoesNotExposeIdentityOrBackendObjects",
        "TestMyOrderToProtoPreservesTaxableAmountSnapshot",
        "TestOAuthChainFailsBeforeHandlerForIdentityAndScopeErrors",
        "TestOAuthIdentityInterceptorPreservesOnlySafePendingCode",
        "TestOAuthInterceptorRequiresAuthorizationBearerAndInjectsPrincipal",
        "TestOAuthScopeInterceptorFailsClosedForUnknownMethod",
        "TestOAuthValidationErrorNeverWrapsSensitiveCause",
        "TestOAuthValidatorAcceptsValidRSATokenAndNormalizesScopes",
        "TestOAuthValidatorCachesAndRefreshesOnUnknownKid",
        "TestOAuthValidatorClockSkewBoundaries",
        "TestOAuthValidatorJWKSBoundsTimeoutAndStaleRules",
        "TestOAuthValidatorJWKSBoundsTimeoutAndStaleRules/known_stale_key_only",
        "TestOAuthValidatorJWKSBoundsTimeoutAndStaleRules/response_size",
        "TestOAuthValidatorJWKSBoundsTimeoutAndStaleRules/timeout",
        "TestOAuthValidatorRejectsCryptographicAndClaimFailures",
        "TestOAuthValidatorRejectsCryptographicAndClaimFailures/bad_algorithm",
        "TestOAuthValidatorRejectsCryptographicAndClaimFailures/bad_audience",
        "TestOAuthValidatorRejectsCryptographicAndClaimFailures/bad_client",
        "TestOAuthValidatorRejectsCryptographicAndClaimFailures/bad_issuer",
        "TestOAuthValidatorRejectsCryptographicAndClaimFailures/bad_signature",
        "TestOAuthValidatorRejectsCryptographicAndClaimFailures/expired",
        "TestOAuthValidatorRejectsCryptographicAndClaimFailures/future_issued",
        "TestOAuthValidatorRejectsCryptographicAndClaimFailures/missing_authorized_party",
        "TestOAuthValidatorRejectsCryptographicAndClaimFailures/missing_kid",
        "TestOAuthValidatorRejectsCryptographicAndClaimFailures/missing_session_id",
        "TestOAuthValidatorRejectsCryptographicAndClaimFailures/missing_subject",
        "TestOAuthValidatorRejectsCryptographicAndClaimFailures/missing_token_id",
        "TestOAuthValidatorRejectsCryptographicAndClaimFailures/not_yet_valid",
        "TestOAuthValidatorRejectsCryptographicAndClaimFailures/unknown_kid",
        "TestOAuthValidatorRejectsMalformedAndOversizedTokensWithoutLeak",
        "TestOAuthValidatorSingleFlightsConcurrentJWKSRefresh",
        "TestOperationStatusErrorBound",
        "TestOrderLifecycleAndOperationStatusUseEnums",
        "TestPreferenceAggregateResponseSizeFailsPrivately",
        "TestPreferenceConsumerMetadataIsServerOwned",
        "TestPreferenceJSONClosedUnionRejectsNullAndAmbiguity",
        "TestPreferenceMethodsAreCustomerOnlyAndProtected",
        "TestPreferenceNestedJSONAuthorityRejectedBeforeDispatch",
        "TestPreferenceRequestGraphIsClosed",
        "TestPreferenceRequestsExposeNoIdentityOrAuthority",
        "TestPreferenceValueIsClosedTypedUnion",
        "TestPreferenceValueMapperDoesNotAliasLists",
        "TestPreferenceValueMapperRejectsInvalidInput",
        "TestPreferenceValueMapperRoundTripsEveryKind",
        "TestPreviewUpdatesAndOperationReconciliation",
        "TestProductCurrencyFollowsExactMoney",
        "TestProtectedPoliciesRequireNonEmptyCanonicalScopes",
        "TestPublicAllowlistIsOnlyHealth",
        "TestRBACAllowsPermittedRole",
        "TestRBACPublicMethodBypassesChecker",
        "TestRBACRejectsDeniedRole",
        "TestRBACRejectsUnauthenticatedProtectedMethod",
        "TestRecursiveUnknownFieldsAndStrictJSON",
        "TestRequestBoundaryCombinations",
        "TestRequestBoundsAndFilters",
        "TestRequestBoundsAndFilters/category_repeated",
        "TestRequestBoundsAndFilters/category_unknown",
        "TestRequestBoundsAndFilters/id_missing",
        "TestRequestBoundsAndFilters/id_too_long",
        "TestRequestBoundsAndFilters/id_url",
        "TestRequestBoundsAndFilters/negative_page",
        "TestRequestBoundsAndFilters/page_overflow",
        "TestRequestBoundsAndFilters/query_control",
        "TestRequestBoundsAndFilters/query_overflow",
        "TestRequestBoundsAndFilters/scope_unknown",
        "TestRequestBoundsAndFilters/search_consumer_unknown",
        "TestRequestBoundsAndFilters/status_enum_unknown",
        "TestRequestBoundsAndFilters/status_key_missing",
        "TestRequestBoundsAndFilters/status_key_overflow",
        "TestRequestBoundsAndFilters/status_unspecified",
        "TestRequestBoundsAndFilters/token_overflow",
        "TestResponseEnumsVersionsAndPreviews",
        "TestResponseEnvelopeVersionsBoundsAndErrors",
        "TestScopeValidation",
        "TestSelfCartMethodsAreCustomerOnlyAndProtected",
        "TestSelfCartRBACAndLoggingBoundary",
        "TestSelfCartRPCDescriptor",
        "TestSelfCartRequestsDoNotSelectAuthority",
        "TestSelfOrderMethodsAreCustomerOnlyAndProtected",
        "TestSelfOrderRequestsContainNoIdentityOrAuthoritySelectors",
        "TestSelfServiceRemovedFieldsRemainReserved",
        "TestSelfServiceRequestsDoNotExposeOwnerSelectors",
        "TestServiceProtoRoundTrip",
        "TestTXSEContextCannotSelectAuthority",
        "TestUpsertCombinationsAndVersions",
        "TestUpsertCombinationsAndVersions/canonical_and_custom",
        "TestUpsertCombinationsAndVersions/create_resource_version",
        "TestUpsertCombinationsAndVersions/definition_version_zero",
        "TestUpsertCombinationsAndVersions/fingerprint_malformed",
        "TestUpsertCombinationsAndVersions/input_missing",
        "TestUpsertCombinationsAndVersions/key_missing",
        "TestUpsertCombinationsAndVersions/negative_profile",
        "TestUpsertCombinationsAndVersions/no_definition_or_custom_key",
        "TestUpsertCombinationsAndVersions/scope_missing",
        "TestUpsertCombinationsAndVersions/unknown_level",
        "TestUpsertCombinationsAndVersions/unspecified_level",
        "TestUpsertCombinationsAndVersions/update_missing_resource_version",
        "TestUpsertCombinationsAndVersions/value_missing",
        "TestUpsertCombinationsAndVersions/zero_profile",
        "TestUserFromProtoHandlesNil",
        "TestUserProtoRoundTrip",
        "TestUsersToProtoPreservesLengthAndOrder",
        "TestValueValidation",
        "TestValueValidation/control",
        "TestValueValidation/duplicate_options",
        "TestValueValidation/empty_option",
        "TestValueValidation/empty_options",
        "TestValueValidation/empty_text",
        "TestValueValidation/false_is_set",
        "TestValueValidation/invalid_utf8",
        "TestValueValidation/money",
        "TestValueValidation/negative_money",
        "TestValueValidation/nil",
        "TestValueValidation/nil_money",
        "TestValueValidation/nil_options",
        "TestValueValidation/option",
        "TestValueValidation/option_overflow",
        "TestValueValidation/options",
        "TestValueValidation/signed_integer",
        "TestValueValidation/text",
        "TestValueValidation/text_boundary",
        "TestValueValidation/text_overflow",
        "TestValueValidation/true",